{
  "schema_version": "4.0",
  "execution_id": "reference-fb3278a105de4a938e1f992a2feb4fce",
  "case_id": "case001-v2",
  "source_id": "src-authored-order-csv",
  "family_id": "fam-authored-order-csv",
  "task_id": "case001-v2.example",
  "contract_id": "case001-v2.contract-v1",
  "judge_id": "case001-v2.judge-v1",
  "run_id": null,
  "mode": "reference",
  "execution_repeat": 1,
  "status": "completed",
  "failure_category": "none",
  "reason": "Actual local reference implementation; not generated skill or model performance",
  "executor": {
    "id": "case001-reference",
    "version": "case001-reference-1",
    "model": null
  },
  "input_before": {
    "orders.csv": "4594783ac6f5d3247ff7e0fdcd2fb02d08106689ab5ca37e81105ef769a530a8"
  },
  "input_after": {
    "orders.csv": "4594783ac6f5d3247ff7e0fdcd2fb02d08106689ab5ca37e81105ef769a530a8"
  },
  "actual_outputs": {
    "deduplicated.csv": "order_id,customer_id,updated_at,amount\n001,C1,2026-01-01T00:00:00Z,12.50\n002,UNKNOWN,2026-01-02T00:00:00Z,0.00\n003,C1,2026-01-03T00:00:00Z,2.25\n",
    "summary.csv": "customer_id,order_count,total_amount,latest_updated_at\nC1,2,14.75,2026-01-03T00:00:00Z\nUNKNOWN,1,0.00,2026-01-02T00:00:00Z\n"
  },
  "error": null,
  "exit_code": 0,
  "started_at_utc": "2026-09-26T14:17:38.286647+00:00",
  "finished_at_utc": "2026-09-26T14:17:38.289830+00:00",
  "dataset_freeze_sha256": "ee8f5d2bec15099dad4344a4a3d2760d974f297f3d11a9b52f6edc5c62a8038e",
  "run_checksums_sha256": null,
  "standard_hashes": {
    "standards/case001/tasks/case001-v2.example.json": "7f47afa43edc5a78880d76e2661ace05af94713279cc7be5d07f8b0bea9ebd8d",
    "standards/case001/contract.json": "d3e00ac65e689879e707f3bc127bbb2bd1c8e58eb5845497fed250af99c50ade",
    "scripts/judge_csv.py": "4df233da7f7c1a944f681956a3518b747f10ca7fcb368cc461e8e6bf2c92b5a0",
    "scripts/reference_csv.py": "a168a897a3dee2bbcdb00a31df6080ff776c2ecd658a22aa589e84bb35179778"
  }
}
