{
  "schema_version": "4.0",
  "execution_id": "reference-b913da7742a841b1b004a9bc270cc071",
  "case_id": "case001-v2",
  "source_id": "src-authored-order-csv",
  "family_id": "fam-authored-order-csv",
  "task_id": "case001-v2.empty",
  "contract_id": "case001-v2.contract-v1",
  "judge_id": "case001-v2.judge-v1",
  "run_id": null,
  "mode": "reference",
  "execution_repeat": 1,
  "status": "completed",
  "failure_category": "none",
  "reason": "Actual local reference implementation; not generated skill or model performance",
  "executor": {
    "id": "case001-reference",
    "version": "case001-reference-1",
    "model": null
  },
  "input_before": {
    "orders.csv": "e3b0c44298fc1c149afbf4c8996fb92427ae41e4649b934ca495991b7852b855"
  },
  "input_after": {
    "orders.csv": "e3b0c44298fc1c149afbf4c8996fb92427ae41e4649b934ca495991b7852b855"
  },
  "actual_outputs": {},
  "error": {
    "record": null,
    "field": "header",
    "message": "Header must match exactly"
  },
  "exit_code": 1,
  "started_at_utc": "2026-09-26T14:17:38.344769+00:00",
  "finished_at_utc": "2026-09-26T14:17:38.346769+00:00",
  "dataset_freeze_sha256": "ee8f5d2bec15099dad4344a4a3d2760d974f297f3d11a9b52f6edc5c62a8038e",
  "run_checksums_sha256": null,
  "standard_hashes": {
    "standards/case001/tasks/case001-v2.empty.json": "d323bab5dfd9bfd05d440e5d5d6c0423e58c599e4d5b02dae18236217cd91395",
    "standards/case001/contract.json": "d3e00ac65e689879e707f3bc127bbb2bd1c8e58eb5845497fed250af99c50ade",
    "scripts/judge_csv.py": "4df233da7f7c1a944f681956a3518b747f10ca7fcb368cc461e8e6bf2c92b5a0",
    "scripts/reference_csv.py": "a168a897a3dee2bbcdb00a31df6080ff776c2ecd658a22aa589e84bb35179778"
  }
}
