{
  "schema_version": "4.0",
  "execution_id": "reference-a598f2edc32a48fcb359db100d77e236",
  "case_id": "case001-v2",
  "source_id": "src-authored-order-csv",
  "family_id": "fam-authored-order-csv",
  "task_id": "case001-v2.wrong_field_count",
  "contract_id": "case001-v2.contract-v1",
  "judge_id": "case001-v2.judge-v1",
  "run_id": null,
  "mode": "reference",
  "execution_repeat": 1,
  "status": "completed",
  "failure_category": "none",
  "reason": "Actual local reference implementation; not generated skill or model performance",
  "executor": {
    "id": "case001-reference",
    "version": "case001-reference-1",
    "model": null
  },
  "input_before": {
    "orders.csv": "eff6fa083400b8b272b9c90b7ddb8bf69d9b6069751d3015b931d213d8600587"
  },
  "input_after": {
    "orders.csv": "eff6fa083400b8b272b9c90b7ddb8bf69d9b6069751d3015b931d213d8600587"
  },
  "actual_outputs": {},
  "error": {
    "record": 1,
    "field": null,
    "message": "Expected four fields"
  },
  "exit_code": 1,
  "started_at_utc": "2026-09-26T14:17:38.356769+00:00",
  "finished_at_utc": "2026-09-26T14:17:38.358769+00:00",
  "dataset_freeze_sha256": "ee8f5d2bec15099dad4344a4a3d2760d974f297f3d11a9b52f6edc5c62a8038e",
  "run_checksums_sha256": null,
  "standard_hashes": {
    "standards/case001/tasks/case001-v2.wrong_field_count.json": "186d088957701f728c350be8d698cc076c2aa12ce0d0239bbf9b58d0fee2fbab",
    "standards/case001/contract.json": "d3e00ac65e689879e707f3bc127bbb2bd1c8e58eb5845497fed250af99c50ade",
    "scripts/judge_csv.py": "4df233da7f7c1a944f681956a3518b747f10ca7fcb368cc461e8e6bf2c92b5a0",
    "scripts/reference_csv.py": "a168a897a3dee2bbcdb00a31df6080ff776c2ecd658a22aa589e84bb35179778"
  }
}
