{
  "schema_version": "4.0",
  "execution_id": "reference-84f2044248464b49bd8a54d08608c575",
  "case_id": "case001-v2",
  "source_id": "src-authored-order-csv",
  "family_id": "fam-authored-order-csv",
  "task_id": "case001-v2.offset_0830",
  "contract_id": "case001-v2.contract-v1",
  "judge_id": "case001-v2.judge-v1",
  "run_id": null,
  "mode": "reference",
  "execution_repeat": 1,
  "status": "completed",
  "failure_category": "none",
  "reason": "Actual local reference implementation; not generated skill or model performance",
  "executor": {
    "id": "case001-reference",
    "version": "case001-reference-1",
    "model": null
  },
  "input_before": {
    "orders.csv": "513ec19413583718be3d6e13fc76133b4864585c2192b2a0bda33deeffe3b6c9"
  },
  "input_after": {
    "orders.csv": "513ec19413583718be3d6e13fc76133b4864585c2192b2a0bda33deeffe3b6c9"
  },
  "actual_outputs": {
    "deduplicated.csv": "order_id,customer_id,updated_at,amount\n001,C1,2026-01-01T00:00:00Z,1.00\n",
    "summary.csv": "customer_id,order_count,total_amount,latest_updated_at\nC1,1,1.00,2026-01-01T00:00:00Z\n"
  },
  "error": null,
  "exit_code": 0,
  "started_at_utc": "2026-09-26T14:17:38.299892+00:00",
  "finished_at_utc": "2026-09-26T14:17:38.303890+00:00",
  "dataset_freeze_sha256": "ee8f5d2bec15099dad4344a4a3d2760d974f297f3d11a9b52f6edc5c62a8038e",
  "run_checksums_sha256": null,
  "standard_hashes": {
    "standards/case001/tasks/case001-v2.offset_0830.json": "ce3eb525f2936fefcd0e8ac4875992fb6bf005bfd46f54454ee4555727d6725a",
    "standards/case001/contract.json": "d3e00ac65e689879e707f3bc127bbb2bd1c8e58eb5845497fed250af99c50ade",
    "scripts/judge_csv.py": "4df233da7f7c1a944f681956a3518b747f10ca7fcb368cc461e8e6bf2c92b5a0",
    "scripts/reference_csv.py": "a168a897a3dee2bbcdb00a31df6080ff776c2ecd658a22aa589e84bb35179778"
  }
}
