{
  "schema_version": "4.0",
  "execution_id": "reference-367b5e5d118047ec8f39ee91914b39d2",
  "case_id": "case001-v2",
  "source_id": "src-authored-order-csv",
  "family_id": "fam-authored-order-csv",
  "task_id": "case001-v2.invalid_amount_neg1",
  "contract_id": "case001-v2.contract-v1",
  "judge_id": "case001-v2.judge-v1",
  "run_id": null,
  "mode": "reference",
  "execution_repeat": 1,
  "status": "completed",
  "failure_category": "none",
  "reason": "Actual local reference implementation; not generated skill or model performance",
  "executor": {
    "id": "case001-reference",
    "version": "case001-reference-1",
    "model": null
  },
  "input_before": {
    "orders.csv": "42101331a294c36598d4de904ca2706bd61b3a0723bf3046f93614c4e926cdf0"
  },
  "input_after": {
    "orders.csv": "42101331a294c36598d4de904ca2706bd61b3a0723bf3046f93614c4e926cdf0"
  },
  "actual_outputs": {},
  "error": {
    "record": 1,
    "field": "amount",
    "message": "Invalid nonnegative fixed-point amount"
  },
  "exit_code": 1,
  "started_at_utc": "2026-09-26T14:17:38.405150+00:00",
  "finished_at_utc": "2026-09-26T14:17:38.408410+00:00",
  "dataset_freeze_sha256": "ee8f5d2bec15099dad4344a4a3d2760d974f297f3d11a9b52f6edc5c62a8038e",
  "run_checksums_sha256": null,
  "standard_hashes": {
    "standards/case001/tasks/case001-v2.invalid_amount_neg1.json": "457a2d8553a3ddb7779c3800db2ec5a2c3913bd97de6c475dbcf518bcec0f81c",
    "standards/case001/contract.json": "d3e00ac65e689879e707f3bc127bbb2bd1c8e58eb5845497fed250af99c50ade",
    "scripts/judge_csv.py": "4df233da7f7c1a944f681956a3518b747f10ca7fcb368cc461e8e6bf2c92b5a0",
    "scripts/reference_csv.py": "a168a897a3dee2bbcdb00a31df6080ff776c2ecd658a22aa589e84bb35179778"
  }
}
