{
  "schema_version": "4.0",
  "execution_id": "reference-da65f41046dc48d69268fb11152dd034",
  "case_id": "case001-v2",
  "source_id": "src-authored-order-csv",
  "family_id": "fam-authored-order-csv",
  "task_id": "case001-v2.header_only",
  "contract_id": "case001-v2.contract-v1",
  "judge_id": "case001-v2.judge-v1",
  "run_id": null,
  "mode": "reference",
  "execution_repeat": 1,
  "status": "completed",
  "failure_category": "none",
  "reason": "Actual local reference implementation; not generated skill or model performance",
  "executor": {
    "id": "case001-reference",
    "version": "case001-reference-1",
    "model": null
  },
  "input_before": {
    "orders.csv": "d081cd4e19b6f3b53f3a38219d2da974955cc95e0e2f56f472a7b3b1458802f5"
  },
  "input_after": {
    "orders.csv": "d081cd4e19b6f3b53f3a38219d2da974955cc95e0e2f56f472a7b3b1458802f5"
  },
  "actual_outputs": {
    "deduplicated.csv": "order_id,customer_id,updated_at,amount\n",
    "summary.csv": "customer_id,order_count,total_amount,latest_updated_at\n"
  },
  "error": null,
  "exit_code": 0,
  "started_at_utc": "2026-09-26T14:17:38.330763+00:00",
  "finished_at_utc": "2026-09-26T14:17:38.333763+00:00",
  "dataset_freeze_sha256": "ee8f5d2bec15099dad4344a4a3d2760d974f297f3d11a9b52f6edc5c62a8038e",
  "run_checksums_sha256": null,
  "standard_hashes": {
    "standards/case001/tasks/case001-v2.header_only.json": "ff3fc4d4c9b29a5cee27002edac9267ba32d4ccb7994f3d69199c57a79276b31",
    "standards/case001/contract.json": "d3e00ac65e689879e707f3bc127bbb2bd1c8e58eb5845497fed250af99c50ade",
    "scripts/judge_csv.py": "4df233da7f7c1a944f681956a3518b747f10ca7fcb368cc461e8e6bf2c92b5a0",
    "scripts/reference_csv.py": "a168a897a3dee2bbcdb00a31df6080ff776c2ecd658a22aa589e84bb35179778"
  }
}
