{
  "schema_version": "4.0",
  "execution_id": "reference-8d2b88b7523f47c78613933c2b78799c",
  "case_id": "case001-v2",
  "source_id": "src-authored-order-csv",
  "family_id": "fam-authored-order-csv",
  "task_id": "case001-v2.invalid_amount_NA",
  "contract_id": "case001-v2.contract-v1",
  "judge_id": "case001-v2.judge-v1",
  "run_id": null,
  "mode": "reference",
  "execution_repeat": 1,
  "status": "completed",
  "failure_category": "none",
  "reason": "Actual local reference implementation; not generated skill or model performance",
  "executor": {
    "id": "case001-reference",
    "version": "case001-reference-1",
    "model": null
  },
  "input_before": {
    "orders.csv": "a5fea72d894f4f1541d69af30c8dcb0dfba40265b909e93b9b3f4ba58e2ab3f6"
  },
  "input_after": {
    "orders.csv": "a5fea72d894f4f1541d69af30c8dcb0dfba40265b909e93b9b3f4ba58e2ab3f6"
  },
  "actual_outputs": {},
  "error": {
    "record": 1,
    "field": "amount",
    "message": "Invalid nonnegative fixed-point amount"
  },
  "exit_code": 1,
  "started_at_utc": "2026-09-26T14:17:38.380788+00:00",
  "finished_at_utc": "2026-09-26T14:17:38.382787+00:00",
  "dataset_freeze_sha256": "ee8f5d2bec15099dad4344a4a3d2760d974f297f3d11a9b52f6edc5c62a8038e",
  "run_checksums_sha256": null,
  "standard_hashes": {
    "standards/case001/tasks/case001-v2.invalid_amount_NA.json": "c13808e1f65386e36a161bb68dc390bfed44d31e25ef3d84bca7b032997b5711",
    "standards/case001/contract.json": "d3e00ac65e689879e707f3bc127bbb2bd1c8e58eb5845497fed250af99c50ade",
    "scripts/judge_csv.py": "4df233da7f7c1a944f681956a3518b747f10ca7fcb368cc461e8e6bf2c92b5a0",
    "scripts/reference_csv.py": "a168a897a3dee2bbcdb00a31df6080ff776c2ecd658a22aa589e84bb35179778"
  }
}
